<?xml version="1.0" encoding="ISO-8859-1"?>
<!DOCTYPE mapper SYSTEM "https://gitee.com/aurora-engine/sgo/blob/master/sgo.dtd">

<mapper namespace="UserMapper">
    <select id="find">
        select * from student where sss={name}
        <if expr="{arr}!=nil and {len(arr)}>0">
            and
            <for slice="{arr}" item="obj" column="id" open="("  separator="," close=")" >
                {obj}
            </for>
        </if>

        <if expr="{name}=='aaa'" >
          and abc = {name}
            <if expr="1==1">
                and 1={name}
                <if expr="1==1">
                    or 1!={name}
                </if>
            </if>
           or cba={name}
        </if>
        or  name = {name} and 1=1
    </select>

    <select id="FindUser">
        select user_age from comm_user where user_id={id}
    </select>

    <select id="UserSelect">
        select * from comm_user where user_id={id}
    </select>

</mapper>